period,event_type,mention_count,descriptions
不明,社交关系状态,1,拥有 cos 搭子、后宫、金主姐姐及 JK 妈妈等多元社交关系
不明,情感经历状态,1,从未交往过拥有男闺蜜的伴侣
不明,观点重申,1,作者反复强调“女生喜欢你就会愿意为你花钱”这一观点近一百遍。
不明,家庭关系认知,1,从小就有姐姐或妹妹陪伴
不明,养老规划设想,1,计划未来为父母开设高级养老院
不明,求助经历,1,在浙江遇到困难时 80% 的情况都有人帮忙
不明,日常交流,1,与超市老板、服务员及方丈交流时感受到对方的客气礼貌
不明,警务接触,1,接触浙江警察时感受到其态度良好
不明,人际观察,1,观察到浙江小姑娘乖巧可爱
不明,亲戚频繁造访,1,亲戚孩子因喜爱作者家的氛围而频繁来访甚至赖着不走
不明,开放玩具与陪伴,1,作者向弟妹开放所有玩具并全程陪伴他们娱乐
不明,款待活动安排,1,作者为来访的亲戚孩子制作烧烤并带其游玩
不明,聚会后空虚感,1,亲戚聚会结束后作者因房屋突然空荡而感到惆怅
不明,模特班同学,1,作者与后辈在模特班相识但当时几乎无交集
不明,模特班毕业,1,作者退出模特行业后与后辈在游戏展重逢并成为朋友
不明,朋友日常相处,1,作者与后辈建立基于金钱坦诚的轻松友谊
不明,朋友调侃,1,后辈在作者去成都接人途中通过手机持续揶揄作者
不明,朋友评价,1,作者欣赏后辈的坦诚并认为她是不相信爱情的好玩伴
不明,交往对象观察,1,作者交往过的性格开放或恶劣的姑娘大多有纹身
不明,目睹抽烟场景,1,作者目睹年轻纹身姑娘熟练抽烟并与其发生言语互动
不明,寻找纹身经历,1,作者曾试图在一名金发女子身上寻找纹身却一无所获
不明,热恋体验缺失,1,作者未曾经历过如胶似漆黏腻拉丝的热恋状态
不明,同居吸引状态,1,作者虽交往对象未成年，却常有人被引诱至其家中居住
不明,自我心态反思,1,作者反思自己反复强调“不介意”的行为显得过于隐忍
不明,后辈打工经历,1,后辈在不援交时去女仆咖啡厅打零工
不明,漫展 Cosplay 搭档,1,作者与一位女性 Coser 在漫展期间共同活动并建立亲密关系
不明,酒店私密互动,1,作者在漫展结束后与搭档在酒店饮酒并发生亲密行为
不明,情感博弈与告白,1,作者与搭档互相揭露关于“假男友”的谎言，并确认彼此早已互相告白的过往
不明,审美偏好陈述,1,作者表达了对特定体型（白瘦幼或肌肉黑皮）的审美标准
不明,他人观察描述,1,作者提及见过名为“妃咲”的人并描述其身材特征
不明,主观感受表达,1,作者对运动系少女的腹肌产生想紧紧抱住的冲动
不明,旅途偶遇,1,在旅游车上偶遇一位四岁小女孩并与其成为朋友
不明,应对突发,1,面对小女孩突然掀衣举动时选择低头回避
不明,教育引导,1,认真教导小女孩不能在他人面前掀衣服
不明,持续陪伴,1,在车上陪伴小女孩一整天直至下车出站
不明,临别互动,1,出站时与小女孩告别并听到她对自己同伴的误称
不明,识人判断,1,作者认为自己能准确预判他人未来的成就
不明,母亲回忆往事,1,作者母亲提及自己在九十年代末混迹 cos 圈的经历
不明,角色扮演体验,1,作者描述参与 cosplay 时制作服装与道具带来的成就感
不明,观察经历,1,作者在工作中接触过许多一心想要出人头地的创业穷小伙
不明,漫展角色扮演,1,作者与 CP 在漫展分别扮演不同角色并遭遇大量互动拍照请求
不明,意外摔倒,1,作者因天气炎热拒绝拍照时，CP 社恐逃跑途中不慎摔入其怀中
不明,围观起哄,1,作者与 CP 摔倒后引发周围人群围观并请求拍摄该场景
不明,接受馈赠,1,接受女生请吃饭、买衣物及带其游玩
不明,二次元周边收藏,1,收集做工精良的 cos 鞋和各类颜色的 jk 制服小领结
不明,展会物品接收,1,朋友在漫展结束后将鞋和衣服直接送给作者
不明,遭遇荒诞邀约,1,被一名女子以收集小说素材为由邀请进行无安全词的 SM 活动
不明,果断终止行为,1,因对方拒绝设定安全词而扔掉钥匙并立即离开
不明,持续收集行为,1,从多位女性手中获得不同时期的校服
不明,持有特定藏品,1,收藏两套上海九十年代蓝色校服（含原品与仿品）
不明,春节带娃,1,家人出钱让作者在大年三十照顾小孩
不明,春节陪大小姐,1,当年有人出钱让作者在大年夜陪伴大小姐
不明,未训练期体能优势,1,未接受正规训练时 1000 米跑获全年级第一
不明,训练后校内夺魁,1,经过一年正规训练后获得全校第一
不明,区级比赛失利,1,在区级比赛中被一名身材瘦小的对手轻松击败
不明,抱持体验,1,作者曾抱过许多体重 40kg 以下的女性并描述其触感
不明,认知更新,1,作者后来才了解到“脂包骨”这一概念
不明,结识性格恶劣的 Cos 搭子,1,作者曾与一位性格极端、行为出格的 Cos 搭子共同活动
不明,目睹搭子出轨与养舔狗,1,作者亲眼见到搭子在电话中出轨并让追求者送避孕药等物品
不明,目睹搭子暴露狂行为,1,作者知晓搭子拍摄私密视频并诱骗陌生人的疯狂行径
不明,被搭子戏称为小碧池,1,作者被这位搭子要求称呼其为“小碧池”
不明,收到搭子转赠的奶茶,1,作者因搭子不爱喝而收到了货拉拉小哥送给搭子的奶茶
不明,观察搭子受追捧现象,1,作者观察到搭子因外貌出众而受到面包店阿姨及追求者的特殊对待
不明,早期碧蓝航线摄影,1,作者自称是国内最早一批拍摄碧蓝航线套图的摄影师
不明,结识测试服玩家,1,作者的 Cos 搭子是碧蓝航线测试服玩家且当时是现役高中生
不明,协助定制 Cos 服,1,作者帮搭子找资料制作高雄 Cos 服的绶带和肩章
不明,漫展拍摄经历,1,作者常在漫展拍摄搭子，并需将其从围观游客中拉出
不明,拍摄时遭遇干扰,1,拍摄期间搭子因游戏活动进度而边换装边肝游戏，无视拍摄进度
不明,协助调整义乳,1,作者见证搭子因义乳质感太假而改用胸垫硬垫出可畏角色
不明,拍摄柴郡私房,1,作者拍摄了早于推特公开视频的柴郡私房照
不明,诱导拍摄长门,1,作者被搭子诱骗外出后，目睹其反锁房门并换上大号长门 Cos 服
不明,朋友出 Cos 被夸身材,1,作者提到一位黑瘦柴的朋友出 Cos 时仍被夸赞身材好
不明,漫展被表白,1,在漫展出兰斯洛特时因单手撑桌跨入摊位的动作被摊主妹子告白
不明,联谊被表白,1,在联谊活动中因跑步胜过体校妹子并说出特定话语而被其告白
不明,伴侣生理期回避,1,作者提到其伴侣在生理期时会躲进房间并让作者将物品放在门口。
不明,伴侣情绪预警,1,作者转述伴侣称生理期时无法控制怒气，因此要求作者不要打扰。
不明,朋友防走光经历,1,朋友穿 Lolita 裙需别五个别针以防走光
不明,朋友练拳击,1,朋友心血来潮去拳馆练习拳击
不明,陪朋友格斗,1,作者陪朋友玩无差别格斗时因害羞未还手并挨打
不明,被当作备选方案,1,作者被一位姿色气质一般的姑娘视为玩腻后的接盘托底方案
不明,关系被刻意维系,1,作者在对方寻找其他下家时仍被对方时不时维系关系
不明,持续恋爱状态,1,作者目前仍与这位姑娘保持恋爱关系
不明,观察他人互动,1,作者认为某段文字挑逗语气别扭且油腻
不明,交往经历,1,作者曾交往过许多未成年女学生（JK）
不明,社交场景假设,1,作者设想对爱慕者或女友说特定话语时的反应
不明,语言感受体验,1,作者听到“贤妻良母”一词时感到恶寒并联想旧道德
不明,宠物抢食,1,作者被宠物抢走泡好的面
不明,共食互动,1,作者将宠物抱在腿上让其进食同时抚摸
不明,婚姻筹备观察,1,作者认为很少有人在临结婚时才商量家务分工问题
不明,行为推测,1,作者推测可能存在一方婚前承诺包揽家务、婚后却试图教育对方做家务的情况
不明,组建游戏战队,1,作者曾与一位女性搭档共同组建了一个接近 30 人的 Cosplay 游戏团队
不明,自我认知探索,1,作者通过前搭档的反馈与分析，确认了自己存在性瘾及性能力水平
不明,性格重塑,1,作者通过与前搭档的互动，完成了对女性建立无所畏惧性格的最后拼图
不明,情感边界界定,1,作者明确前搭档并非其女友，且对方已有男友
不明,模特班后辈援交见闻,1,作者通过模特班后辈的讲述，了解到未成年援交者遭遇的男性普遍虚伪及“救风尘”式白嫖的现实情况。
不明,账号运营压力,1,粉丝过万后无力独自打理 Coser 账号
不明,日常高强度工作,1,每周需完成拍照修图发布及处理骚扰私信
不明,商务沟通,1,每日筛选合作信息并加微信详聊委托或嘉宾事宜
不明,替人代运营,1,亲自打理 CP 的账号并负责回复粉丝互动
不明,遭遇客户告白,1,作者曾遇到过三位因提供幻觉服务而上头并向其告白的客户。
不明,观察朋友经历,1,作者提到有朋友遇到过认为自己是对方专属的姑娘
不明,总结交往经验,1,作者基于观察提出通过高频相遇来快速试错和识别不合适的人
不明,社交圈观察,1,发现身边男性圈子普遍认同“男人需有钱有底蕴才受女性欣赏”的观点
不明,策略性行动,1,在男性朋友尚未成功时抢先追求他们心仪的女性
不明,人生感悟,1,作者强调拿钱买不到感情且身外之物吸引不到真爱
不明,配音经历,1,作者曾从事配音工作但已许久未进行
不明,角色幻想,1,作者幻想若成为魔法少女会亲自念台词
不明,深夜打车遭遇司机抱怨,1,半夜出机场打车时被迫听司机抱怨排队不易并指责乘客不懂事
不明,体能状态描述,1,作者自述拥有较强的体力。
不明,暴力倾向自述,1,作者承认自己体内存在暴力因子。
不明,生理期状态,1,作者提到自己正处于大姨妈最后一天
不明,等待回应,1,作者多次发消息催促对方回复，表达焦虑与不安
不明,情绪波动,1,作者因对方未及时回复而陷入恐慌，随后又迅速转为关心
不明,恋爱模式固化,1,从小到大只回应主动追求自己的女生，导致对主动示好习以为常
不明,情感耐受期缩短,1,曾有一段时间对恋爱对象的专注时间缩短至仅一周，随后彻底厌烦
不明,频繁周旋与脱身,1,生活模板为被女生勾搭后短暂陪伴，随后寻找借口离开城市并拒绝告白
不明,极限脱身挑战,1,将“几天能体面脱身”作为成就，最快记录为 24 小时内哄好女生让其回归正常生活
不明,试探人性底线,1,曾半开玩笑邀请女生跨越 1500 公里见面，或谎称已有女友来测试对方反应
不明,心理状态转变,1,因“女生主动恐惧症”及空虚感，最终被强势女生治愈并开始学习正常交流
不明,短期亲密关系,1,与一名女性相识两天后决定见面并发生性关系
不明,性观念交流,1,与伴侣在性行为前约定不使用避孕套
不明,情感倾诉,1,听伴侣讲述拒绝追求者三年的男生的原因
不明,全国多地频繁约会,1,作者自称通过频繁飞往全国各地与不同女生见面来积累约会战绩
不明,跨城即时赴约,1,作者描述自己能在上海、城防港、浙江、云南、广州等多地连续快速切换行程与女生见面
不明,无固定工作时间,1,作者自述拥有随时可出发、无需等待休息或出差的充裕空闲时间
不明,赠送定制礼物,1,作者提到在机场购买伴手礼并携带一套跟随自己飞遍半个中国的机车女郎 C 服送给女生
不明,游戏设计经历,1,作者曾设计过一款让未看过高达的女生评价 MS 的游戏
不明,伴侣居家裸体习惯,1,作者伴侣在家基本不穿衣服且喜欢光脚走动
不明,伴侣裸体开门拥抱,1,作者每次去伴侣家时，对方都会全裸开门并直接抱住
不明,网络钓鱼实验,1,作者用朋友照片在推特和知乎测试能否吸引追求者
不明,外貌优势带来的误解,1,作者认为他人对自己恋爱成功的归因其实是源于身高和长相而非技巧。
不明,情感关系经历,1,作者描述了一段在恋爱中因女友情绪失控而被迫充当情绪垃圾桶的虚构或典型化经历
不明,交往金发笨蛋,1,曾与一位外貌精致但性格粗鲁、品味差且爱抽烟的女生交往
不明,交往多位美少女,1,交往过包括天才 JK、男装 Coser、田径部成员等多位外貌出众的女性
不明,社交策略,1,故意延迟回复消息以显得忙碌并尽早结束话题
不明,观察他人习惯,1,发现 CP 和前搭子回复摄影消息通常需要半天以上 / 发现漫展扩列的人往往三天只回一个表情甚至不回
不明,被特殊对待,1,发现 CP 和前搭子对自己总是秒回消息 / 发现前搭子即使见男友时也会秒回自己的消息
不明,推测动机,1,认为对方秒回是为了抓住机会和自己聊天
不明,消费随和,1,与女生外出时从不挑剔食物，无论对方请客还是在家吃剩饭都能接受
不明,金钱观淡然,1,对金钱没有执念和赚钱野心，不靠金钱维持自信也不向女生借钱
不明,被评价穷得理直气壮,1,曾被商会大小姐评价为穷得理直气壮且厚脸皮
不明,田径训练经历,1,作为前田径运动员曾接受专业训练
不明,直线竞速测试,1,在直线奔跑中仅需 5 秒即可追上田径队新手
不明,曲线跑动失误,1,在练习曲线绕圈跑时差点扭伤脚踝
不明,关系认知,1,作者认为互相喜欢会直接进入恋爱状态而无追求过程
不明,情感判断,1,作者认为进入追求状态意味着对方暂时不想选择你
不明,互动分析,1,作者认为所谓的容易追求只是对方本就喜欢才会回应
不明,回校探访,1,作者回学校看望老师并去操场跑步
不明,观察学妹,1,作者观察并对比了现在学妹与过去女生的外貌特征
不明,感官体验,1,作者描述了接触女学生时的皮肤触感、气味及身体细节
不明,长期交友观察,1,从小学至今持续总结与女生交友的经验结论
不明,虚构交友案例,1,描述在鬼屋活动中与心仪女孩从相识到牵手互动的完整过程
不明,现象分析,1,作者认为互联网让男性看清女性主动的表现，使“矜持”等话术失效。
不明,被误认情侣,1,和妹妹外出时店员总误以为两人是情侣
不明,被推销鲜花,1,和姐姐外出时被卖花女孩追着推销
不明,被朋友起哄,1,漫展带 CP 去朋友店里被调侃关系
不明,被误认同性情侣,1,有时和同性外出也会被误认为情侣
不明,朋友社交奇遇,1,目睹朋友因意外露出 Coser 衣物而被另一位 Coser 误认为摄影并成功加微信带走
不明,朋友情绪爆发,1,目睹另一位朋友因 Coser 被朋友“拐跑”而情绪崩溃并嚎啕大哭
不明,遭受无端恶意,1,因表现得没心没肺且总是开心而遭到其他男性的嫉妒与诋毁
不明,被造谣中伤,1,被恶意传播一事无成、吃软饭及欺骗女性的谣言
不明,意外成名,1,因他人的持续诋毁反而在漫展等场合意外获得知名度并收获热情搭讪
不明,被朋友调侃为男魅魔,1,作者被身边的女性朋友评价为擅长调动男性情绪的人
不明,社交聚会中的核心角色,1,作者参加联谊或聚会时，男性总会围拢过来与其热烈讨论
不明,快速建立男性友谊,1,作者能让原本冷漠的男性在短时间内与其称兄道弟
不明,拒绝广泛社交,1,作者表示不打算像假面骑士那样与全世界的人交朋友
不明,服务承诺,1,作者表示愿意以每小时 300 元的价格提供陪伴、倾听及情绪支持服务。
不明,伴侣互动,1,作者长期拒绝伴侣要求朗读女性向羞辱文本的请求 / 作者因伴侣拖延洗澡而强行按在墙边并模仿羞辱台词进行调情
不明,观察角色热度变化,1,作者观察到露露卡从初期小范围人气到春节后因二创爆发而广泛走红
不明,分析创作环境变迁,1,作者分析短视频工具降低了制作门槛，使普通人能实现以往无法完成的幻想短片创作
不明,认知原则,1,坚持只相信亲眼见到和亲身感受的事情
不明,母亲旅行习惯,1,母亲满世界旅行并习惯用上海黄浦区作为评价标准
不明,母亲美国之行,1,母亲从美国回国后评价该国无趣且几乎不出门
不明,母亲反对行为,1,母亲强烈反对我去美国游玩
不明,个人旅行经历,1,去过日本、泰国、东南亚、欧洲、英国、南极和埃及，唯独没去过美国
不明,未来计划,1,打算亲自去美国看看以验证真相
不明,持续处世模式,1,长期依靠礼貌语言和微笑化解潜在冲突，从未遭遇蛮不讲理者
不明,提供伴游服务,1,长期为女性客户提供从行程规划、行李整理到全程陪同的伴游服务
不明,住宿客户家中,1,出发前夜睡在客户家客厅以便次日早起叫醒客户
不明,雇佣朋友接送,1,每次出行都提前通知朋友并在楼下等候，付费请其接送客户
不明,携带少女长途飞行,1,曾带一名 14 岁少女飞越 2500 公里安全与家人团聚
不明,日本高强度伴游,1,曾带一名 28 岁女性在日本进行为期七天的购物与景点高强度行程
不明,陪同 Coser 全国赶展,1,曾陪同 Coser 嘉宾携带重物在一个月内走遍半个中国并负责外勤与妆造
不明,故宫深度讲解,1,曾陪同客户在故宫从午门侃到御花园，甚至将人从景山背下
不明,沉迷校园爱情,1,至今仍在怀念并沉浸于学生时代的纯粹情感中
不明,道德焦虑状态,1,长期活在道德枷锁中，时刻小心翼翼生怕被他人窥探评判
不明,暴雨夜奔酒店,1,与伴侣在暴雨中一路奔跑大笑着冲进酒店并乘电梯
不明,车内嬉闹回忆,1,回忆曾经有女孩坐在后座嬉笑打闹，拍背鼓励自己迎着风浪前行
不明,从事男喘工作,1,作者曾做过一段时间陪女生聊羞耻内容的男喘
不明,接待特定顾客案例,1,作者曾遇到一位刚抱怨继父骚扰随即要求扮演其父亲进行羞辱的顾客
不明,观察顾客心理状态,1,作者发现女性顾客普遍渴望在安全环境下被危险角色控制并享受语言羞辱
不明,探究顾客行为动机,1,作者通过询问得知顾客不愿与男友交流此类需求是出于对关系内控制与尊严的顾虑
不明,职场休息被说教,1,作者在休息日因被强行灌输“记住”的言论而感到逆反
不明,日常工作状态,1,作者认为自己平时一直在勤勤恳恳上班为社会作贡献
不明,母亲育儿方式,1,母亲从不以成绩作为奖励或惩罚条件，常直接邀请作者一同游玩
不明,童年成长状态,1,因母亲包容态度，作者对考试失利和失败从未感到压力
不明,拥有特定性取向朋友,1,作者表示自己有男同和男娘朋友
不明,听闻朋友混乱情史,1,作者被朋友讲述的混乱情史震惊到发愣
不明,被母亲强制穿搭,1,母亲每周带作者逛店试穿搭配，且拒绝淘宝货与二次元风格
不明,高频美发护理,1,母亲要求作者每两周修发、每月做头发
不明,强制面部修饰,1,母亲亲自为作者化妆修眉，严禁脸部不洁
不明,居家裸体习惯,1,因长期被母亲折腾，作者独处时甚至不愿穿衣
不明,频繁接吻经历,1,作者因经常需要接吻而收集各种润唇膏
不明,养狗经历,1,作者家中饲养四条狗
不明,待客规矩,1,有小孩来访时将狗关在围子里
不明,观察狗行,1,目睹狗对摔倒或路过的小孩做出嘲笑或吓唬行为
不明,手机消费观,1,作者曾拒绝购买苹果手机而使用伴侣的备用机
不明,工作现状,1,作者在工作中面临甲方和顾客对进度的不满与催促。
不明,虚拟体验对比,1,作者认为 AI 生成的虚拟互动不如高中生 cos 角色带来的真实触感。
不明,社会现象观察,1,作者指出 AI 泛滥可能引发人类对真实关系的渴望。
不明,恋爱互动观察,1,作者描述恋爱中女生会频繁发消息、时刻黏人并关注情绪变化 / 作者指出女生喜欢时会忍不住凑过来分享趣事或视频，造成“烦人”的互动
不明,个人应对策略,1,作者习惯等女友睡觉或约定特定时间不打扰，以便独自处理事情 / 作者会在女友睡觉时偷偷浏览成人网站以缓解精神消耗
不明,父母持续关爱,1,父母长期给予帮助并表达不求回报的关爱
不明,节日互动,1,逢年过节买年货让父亲感到开心
不明,观察他人恋爱模式,1,作者观察到有人通过卑微讨好、制定计划等方式追求女生并成功
不明,分析情感逻辑,1,作者分析认为上述成功案例是因为女生本就喜欢对方，而非追求方式有效
不明,对说教态度的反感,1,作者厌恶记者强行灌输无用知识并带有爹味说教的行为
不明,心理暗示练习,1,作者建议通过默念贬低自己的话语来克服行动障碍
不明,职场沟通策略,1,作者建议在对方询问是否明白时坚定回答不明白以避免背锅
不明,生活态度主张,1,作者提出不要过度自省反思，认为他人很快会忘记你的错误
不明,羞耻心认知,1,作者认为普通人不应刻意追求羞耻心，因为没人真正在意你
不明,举例说明,1,作者描述了一个携带手办、穿痛衫并牵着 Coser 女友逛漫展的混合身份案例
不明,周末接放学与晚餐准备,1,每周末接大小姐放学回家，在厨房准备晚餐并应对她洗澡后的各种状况
不明,浴室清洁与吹发互动,1,为大小姐吹干头发并反复清理她弄湿的浴室地面
不明,晚餐摆盘与夜宵制作,1,负责晚餐摆盘、热蜂蜜牛奶以及炖煮银耳羹等夜宵
不明,全屋清洁与物品整理,1,反复拖地、洗碗、清理地毯碎屑以及整理大小姐带回的衣物
不明,短暂独处与家务收尾,1,在大小姐回房写作业后获得半小时安静时间，随后继续完成剩余家务
不明,模型摆阵经历,1,作者曾用老胶模型摆阵以证明女生会囤积高达模型
不明,观看动画,1,观看动画剧集并评论角色表现
不明,观剧感悟,1,作者认为黑三连 -1 是好人且战斗规规矩矩 / 作者感叹高中生打架敢动刀子不计后果
不明,剧情质疑,1,作者对鲁姆战役生擒雷比尔的战绩未被雇佣感到疑惑
不明,观看动画剧情,1,作者发现高达系列中联邦与吉恩的军事发展设定存在巨大反差
不明,吐槽剧情逻辑,1,作者质疑吉恩停战反而让联邦获得技术优势导致被推平的设定
不明,网络浏览,1,在 B 站刷同人小说时看到有人阴阳这部作品
不明,身份设定,1,以地球联邦军提坦斯监察科无名少尉的身份撰写观后感
不明,观察演员表演,1,作者通过观看徐峥在《我不是药神》等作品中的表演，分析其角色气质。
不明,回忆市场场景,1,作者描述记忆中襄阳路市场地摊老板叫卖和讨价还价的典型场景。
不明,观看沪语剧集,1,作者提及上海人观看徐峥的沪语剧后能立刻识别其人物特质。
不明,逃学经历,1,作者曾有过逃学并在早上醒来后先担心迟到、后安心躺下的亲身经历。
不明,作品观看体验,1,观看某部动漫第一季时感到极度不适并认为剧情有病
不明,担任 Cos 搭子经纪人兼男友,1,陪一位 Cos 搭子从零起步运营账号，负责化妆、摄影并处理粉丝打赏与邀约，陪其跑遍大半个中国
不明,组织多人 Cos 旅行,1,曾带领四位美少女跑遍半个中国进行外景拍摄与活动
不明,角色创作,1,作者绘制了圆角 JK 风格的角色并塑造到当前程度
不明,作品分析,1,作者分析认为该角色作者认真查找过资料
不明,群体心理推测,1,作者推测缺乏异性经验的死宅面对此类角色会重塑三观
不明,剧情逻辑分析,1,作者认为角色不收钱和常被赶走是剧情需要但略显虚假
不明,广告拍摄,1,儿时拍摄广告时被化妆师评价长相像女孩子
不明,声线困扰,1,因声线被男女通吃地夸奖而感到迷茫
不明,身体特征陈述,1,作者身高 195 厘米，体重 90 公斤
不明,心理反应描述,1,面对发疯的 40 公斤女性时会产生畏惧感
不明,亲友离世,1,作者的所有至亲、朋友和爱人均已去世
不明,孤独生存,1,作者成为亲友中唯一在世的人
不明,积极生活,1,作者决定努力快乐并铭记逝去的亲人
不明,宅男幻想破灭,1,作者设想宅男与宅女因兴趣点错位及观点批判而引发争吵
不明,情感选择假设,1,作者提出在立场相左的共鸣伴侣与包容陪伴的伴侣之间做选择
不明,情绪反应,1,作者对过度敬畏 coser 的态度感到愤怒
不明,家庭背景陈述,1,作者家中有一位拥有专职司机和车辆的“大小姐”
不明,创业套现,1,作者曾开设小公司，通过帮朋友做 PPT 和写规划向家里骗取资金。
不明,被父责罚,1,作者父亲发现其骗钱行为后，责令其关闭业务并注销公司。
不明,无所事事,1,公司被注销后，作者重新陷入没有具体事务的状态。
不明,恋爱观念形成,1,作者认为早恋有益且反对学校关于早恋有害的说教
不明,恋爱行为主张,1,作者主张学生时代应大量接触不同类型的女生并尝试恋爱
